Title,Year,Rating,Votes,Overview,Actors,RT_CriticScore,RT_AudienceScore,RT_Link,Metascore,UserScore,Genres,Director,Runtime
flamin' hot,2023,7.948,705.0,"The inspiring true story of Richard Montañez, the Frito Lay janitor who channeled his Mexican American heritage and upbringing to turn the iconic Flamin' Hot Cheetos into a snack that disrupted the food industry and became a global pop culture phenomenon.","Jesse Garcia, Annie Gonzalez, Emilio Rivera, Vanessa Martinez, Dennis Haysbert",99.0,89.0,,92.0,79.0,"drama, history",Eva Longoria,99.0
flee,2021,8.037,2182.0,,,99.0,89.0,,91.0,80.0,"documentary,animation,biography,drama",Jonas Poher Rasmussen,117.0
flipped,2010,8.023,3098.0,"When Juli meets Bryce in the second grade, she knows it's true love. After spending six years trying to convince Bryce the same, she's ready to give up - until he starts to reconsider.","Madeline Carroll, Callan McAuliffe, Rebecca De Mornay, Anthony Edwards, John Mahoney",99.0,89.0,,92.0,79.0,"romance, drama",Rob Reiner,89.0
flow,2024,8.218,1800.0,"A solitary cat, displaced by a great flood, finds refuge on a boat with various species and must navigate the challenges of adapting to a transformed world together.",,99.0,89.0,,92.0,79.0,"animation, fantasy, adventure",Gints Zilbalodis,85.0
for a few dollars more,1965,8.019,4097.0,"Two bounty hunters both pursue the brutal and sadistic bandit, El Indio, who has a large bounty on his head.","Clint Eastwood, Lee Van Cleef, Gian Maria Volonté, Luigi Pistilli, Klaus Kinski",99.0,89.0,,92.0,79.0,western,Sergio Leone,132.0
for sama,2019,8.037,2182.0,,,99.0,89.0,,89.0,75.0,"documentary,biography,war","Waad Al-Kateab,Edward Watts",117.0
for the bible tells me so,2007,8.037,2182.0,,,98.0,90.0,http://www.rottentomatoes.com/m/for_the_bible_tells_me_so,92.0,79.0,"gay and lesbian, documentary",Daniel G. Karslake,117.0
force of evil,1949,8.037,2182.0,,,99.0,89.0,,89.0,68.0,"crime,drama,film-noir",Abraham Polonsky,117.0
ford v ferrari,2019,8.004,8235.0,"American car designer Carroll Shelby and the British-born driver Ken Miles work together to battle corporate interference, the laws of physics, and their own personal demons to build a revolutionary race car for Ford Motor Company and take on the dominating race cars of Enzo Ferrari at the 24 Hours of Le Mans in France in 1966.","Matt Damon, Christian Bale, Jon Bernthal, Caitríona Balfe, Josh Lucas",99.0,89.0,,92.0,79.0,"drama, action, history",James Mangold,153.0
foreign correspondent,1940,8.037,2182.0,,,99.0,89.0,,89.0,73.0,"action,drama,romance,thriller,war",Alfred Hitchcock,117.0
forgotten,2017,7.9,1159.0,"Seoul, South Korea, 1997. When the young but extremely anxious student Jin-seok, his parents and his successful older brother Yoo-seok move to a new home, mysterious and frightening events begin to happen around them, unexplained events that threaten to ruin their seemingly happy lives. Unable to understand what is happening, Jin-seok wonders if he is losing his mind.","Kang Ha-neul, Kim Moo-yul, Moon Sung-keun, Na Young-hee, Nam Myung-ryeol",99.0,89.0,,92.0,79.0,"thriller, mystery, crime",Jang Hang-Jun,108.0
forgotten love,2023,7.863,304.0,A once-respected surgeon who's lost his family and his memory gets a chance at redemption when he reconnects with someone from his forgotten past.,"Leszek Lichota, Maria Kowalska, Ignacy Liss, Anna Szymańczyk, Izabela Kuna",99.0,89.0,,92.0,79.0,"drama, romance",Michał Gazda,140.0
forrest gump,1994,8.468,28092.0,"A man with a low IQ has accomplished great things in his life and been present during significant historic events—in each case, far exceeding what anyone imagined he could do. But despite all he has achieved, his one true love eludes him.","Tom Hanks, Robin Wright, Gary Sinise, Sally Field, Mykelti Williamson",99.0,89.0,,92.0,79.0,"comedy, drama, romance",Robert Zemeckis,142.0
foxtrot,2017,8.037,2182.0,,,99.0,89.0,,88.0,72.0,drama,Samuel Maoz,117.0
frankenstein,1931,8.037,2182.0,,,100.0,87.0,http://www.rottentomatoes.com/m/1007818-frankenstein,91.0,77.0,"drama,horror,sci-fi,thriller",James Whale,117.0
freedom writers,2007,7.919,2274.0,"A young teacher inspires her class of at-risk students to learn tolerance, apply themselves, and pursue education beyond high school.","Hilary Swank, Patrick Dempsey, Scott Glenn, Imelda Staunton, April Hernandez Castillo",99.0,89.0,,92.0,79.0,"crime, drama",Richard Lagravenese,123.0
frenzy,1972,8.037,2182.0,,,99.0,89.0,,92.0,75.0,"drama,thriller",Alfred Hitchcock,117.0
full metal jacket,1987,8.125,10758.0,A pragmatic U.S. Marine observes the dehumanizing effects the U.S.-Vietnam War has on his fellow recruits from their brutal boot camp training to the bloody street fighting in Hue.,"Matthew Modine, Adam Baldwin, Vincent D'Onofrio, R. Lee Ermey, Dorian Harewood",99.0,89.0,,92.0,79.0,"drama, war",Stanley Kubrick,117.0
funny girl,1968,8.037,2182.0,,,99.0,89.0,,88.0,76.0,"biography,comedy,drama,musical,romance",William Wyler,117.0
gabriel's inferno,2020,8.4,2419.0,"An intriguing and sinful exploration of seduction, forbidden love, and redemption, Gabriel's Inferno is a captivating and wildly passionate tale of one man's escape from his own personal hell as he tries to earn the impossible--forgiveness and love.","Melanie Zanetti, Giulio Berruti, Kurt McKinney, Agnes Albright, Margaux Brooke",99.0,89.0,,92.0,79.0,"romance, drama",Tosca Musk,122.0
gabriel's inferno: part ii,2020,8.4,1521.0,"Professor Gabriel Emerson finally learns the truth about Julia Mitchell's identity, but his realization comes a moment too late. Julia is done waiting for the well-respected Dante specialist to remember her and wants nothing more to do with him. Can Gabriel win back her heart before she finds love in another's arms?","Melanie Zanetti, Giulio Berruti, James Andrew Fraser, Margaux Brooke, Agnes Albright",99.0,89.0,,92.0,79.0,"romance, drama",Tosca Musk,106.0
gabriel's inferno: part iii,2020,8.376,1058.0,The final part of the film adaption of the erotic romance novel Gabriel's Inferno written by an anonymous Canadian author under the pen name Sylvain Reynard.,"Melanie Zanetti, Giulio Berruti, Rhett Wellington Ramirez, James Andrew Fraser, Margaux Brooke",99.0,89.0,,92.0,79.0,"romance, drama",Tosca Musk,102.0
gangs of wasseypur,2015,8.037,2182.0,,,99.0,89.0,,89.0,86.0,"action,comedy,crime,drama,thriller",Anurag Kashyap,117.0
gavagai,2018,8.037,2182.0,,,99.0,89.0,,91.0,74.0,drama,Rob Tregenza,117.0
gentlemen prefer blondes,1953,8.037,2182.0,,,98.0,83.0,http://www.rottentomatoes.com/m/gentlemen_prefer_blondes,92.0,79.0,"comedy, musical",Howard Hawks,117.0
get out,2017,8.037,2182.0,,,98.0,86.0,http://www.rottentomatoes.com/m/get_out,92.0,79.0,"mystery and thriller, comedy, horror",Jordan Peele,117.0
gett: the trial of viviane amsalem,2014,8.037,2182.0,,,100.0,81.0,http://www.rottentomatoes.com/m/gett_the_trial_of_viviane_amsalem,92.0,79.0,drama,"Ronit Elkabetz, Shlomi Elkabetz",117.0
gett: the trial of viviane amsalem,2015,8.037,2182.0,,,99.0,89.0,,90.0,73.0,drama,"Ronit Elkabetz,Shlomi Elkabetz",117.0
ghost in the shell,1995,7.924,3497.0,"In the year 2029, the barriers of our world have been broken down by the net and by cybernetics, but this brings new vulnerability to humans in the form of brain-hacking. When a highly-wanted hacker known as 'The Puppetmaster' begins involving them in politics, Section 9, a group of cybernetically enhanced cops, are called in to investigate and stop the Puppetmaster.","Atsuko Tanaka, Akio Otsuka, Iemasa Kayumi, Koichi Yamadera, Yutaka Nakano",99.0,89.0,,92.0,79.0,"action, animation, science fiction",Mamoru Oshii,83.0
ghost world,2001,8.037,2182.0,,,99.0,89.0,,90.0,76.0,"comedy,drama",Terry Zwigoff,117.0
gifted,2017,8.009,5637.0,"Frank, a single man raising his child prodigy niece Mary, is drawn into a custody battle with his mother.","Chris Evans, Mckenna Grace, Lindsay Duncan, Jenny Slate, Octavia Spencer",99.0,89.0,,92.0,79.0,"drama, comedy",Marc Webb,101.0
given,2020,8.28,398.0,"Haruki secretly had feelings for Akihiko for years, but Akihiko was still in a relationship with his roommate, the violinist Ugetsu Murata. Haruki, Akihiko, and Ugetsu's love clashes and starts to move forward.","Takuya Eguchi, Masatomo Nakazawa, Shogo Yano, Yuma Uchida, Shintaro Asanuma",99.0,89.0,,92.0,79.0,"animation, drama, music, romance",Hikaru Yamaguchi,60.0
gladiator,2000,8.218,19572.0,"After the death of Emperor Marcus Aurelius, his devious son takes power and demotes Maximus, one of Rome's most capable generals who Marcus preferred. Eventually, Maximus is forced to become a gladiator and battle to the death against other men for the amusement of paying audiences.","Russell Crowe, Joaquin Phoenix, Connie Nielsen, Oliver Reed, Richard Harris",99.0,89.0,,92.0,79.0,"action, drama, adventure",Ridley Scott,155.0
gloria,2013,8.037,2182.0,,,99.0,65.0,http://www.rottentomatoes.com/m/gloria_2012,92.0,79.0,"drama, romance",Sebastián Lelio,117.0
god's own country,2017,8.037,2182.0,,,98.0,87.0,http://www.rottentomatoes.com/m/gods_own_country_2017,92.0,79.0,"gay and lesbian, drama, romance",Francis Lee,117.0
goldfinger,1964,8.037,2182.0,,,99.0,89.0,http://www.rottentomatoes.com/m/goldfinger,92.0,79.0,action,Guy Hamilton,117.0
gone girl,2014,7.89,18950.0,"With his wife's disappearance having become the focus of an intense media circus, a man sees the spotlight turned on him when it's suspected that he may not be innocent.","Ben Affleck, Rosamund Pike, Neil Patrick Harris, Tyler Perry, Carrie Coon",99.0,89.0,,92.0,79.0,"mystery, thriller, drama",David Fincher,149.0
gone with the wind,1939,7.934,4109.0,The spoiled daughter of a Georgia plantation owner conducts a tumultuous romance with a cynical profiteer during the American Civil War and Reconstruction Era.,"Vivien Leigh, Clark Gable, Olivia de Havilland, Leslie Howard, Hattie McDaniel",99.0,89.0,,92.0,79.0,"drama, war, romance",Victor Fleming,233.0
gone with the wind,1940,8.037,2182.0,,,99.0,89.0,,97.0,82.0,"drama,romance,war",Victor Fleming,117.0
good will hunting,1997,8.158,12726.0,"Headstrong yet aimless, Will Hunting has a genius-level IQ but chooses to work as a janitor at MIT. When he secretly solves highly difficult graduate-level math problems, his talents are discovered by Professor Gerald Lambeau, who decides to help the misguided youth reach his potential. When Will is arrested for attacking a police officer, Professor Lambeau makes a deal to get leniency for him if he gets court-ordered therapy. Eventually, therapist Dr. Sean Maguire helps Will confront the demons that are holding him back.","Matt Damon, Robin Williams, Ben Affleck, Stellan Skarsgård, Minnie Driver",99.0,89.0,,92.0,79.0,drama,Gus Van Sant,127.0
goodbye solo,2009,8.037,2182.0,,,99.0,89.0,,89.0,70.0,drama,Ramin Bahrani,117.0
goodfellas,1990,8.456,13287.0,"The true story of Henry Hill, a half-Irish, half-Sicilian Brooklyn kid who is adopted by neighbourhood gangsters at an early age and climbs the ranks of a Mafia family under the guidance of Jimmy Conway.","Robert De Niro, Ray Liotta, Joe Pesci, Lorraine Bracco, Paul Sorvino",99.0,89.0,,92.0,90.0,"biography,crime,drama",Martin Scorsese,145.0
gosford park,2001,8.037,2182.0,,,99.0,89.0,,90.0,73.0,"comedy,drama,mystery",Robert Altman,117.0
gran torino,2008,7.989,10888.0,"Disgruntled Korean War veteran Walt Kowalski sets out to reform his neighbor, Thao Lor, a Hmong teenager who tried to steal Kowalski's prized possession: a 1972 Gran Torino.","Clint Eastwood, Christopher Carley, Bee Vang, Ahney Her, Brian Haley",99.0,89.0,,92.0,79.0,drama,Clint Eastwood,116.0
grave of the fireflies,1988,8.5,5842.0,"In the final months of World War II, 14-year-old Seita and his sister Setsuko are orphaned when their mother is killed during an air raid in Kobe, Japan. After a falling out with their aunt, they move into an abandoned bomb shelter. With no surviving relatives and their emergency rations depleted, Seita and Setsuko struggle to survive.","Tsutomu Tatsumi, Ayano Shiraishi, Yoshiko Shinohara, Akemi Yamaguchi, Masayo Sakai",100.0,95.0,http://www.rottentomatoes.com/m/grave_of_the_fireflies,92.0,79.0,"animation, drama, war",Isao Takahata,89.0
grave of the fireflies (1988),1989,8.037,2182.0,,,99.0,89.0,,94.0,89.0,"animation,drama,war",Isao Takahata,117.0
gravity,2013,8.037,2182.0,,,99.0,89.0,,96.0,77.0,"drama,sci-fi,thriller",Alfonso Cuarón,117.0
great expectations,1947,8.037,2182.0,,,99.0,89.0,,90.0,70.0,"adventure,drama,mystery,romance",David Lean,117.0
great freedom,2022,8.037,2182.0,,,99.0,89.0,,89.0,63.0,drama,Sebastian Meise,117.0
green book,2018,8.234,11937.0,"Tony Lip, a bouncer in 1962, is hired to drive pianist Don Shirley on a tour through the Deep South in the days when African Americans, forced to find alternate accommodations and services due to segregation laws below the Mason-Dixon Line, relied on a guide called The Negro Motorist Green Book.","Viggo Mortensen, Mahershala Ali, Linda Cardellini, Sebastian Maniscalco, Dimiter D. Marinov",99.0,89.0,,92.0,79.0,"drama, history",Peter Farrelly,130.0
green border,2024,8.037,2182.0,,,99.0,89.0,,90.0,65.0,drama,Agnieszka Holland,117.0
green snake,2021,8.105,320.0,"While trying to free her sister from Fahai's clutches, Xiao Qing winds up in a dystopian city and meets a mysterious man who can't recall his past life.","Tang Xiaoxi, Zhang Fuzheng, Wei Chao, Zhao Mingzhou, Zheng Xiaopu",99.0,89.0,,92.0,79.0,"animation, fantasy, action, adventure",Amp Wong,131.0
guardians of the galaxy,2014,7.9,28436.0,"Light years from Earth, 26 years after being abducted, Peter Quill finds himself the prime target of a manhunt after discovering an orb wanted by Ronan the Accuser.","Chris Pratt, Zoe Saldaña, Dave Bautista, Vin Diesel, Bradley Cooper",99.0,89.0,,92.0,79.0,"action, science fiction, adventure",James Gunn,121.0
guardians of the galaxy vol. 3,2023,7.9,7264.0,"Peter Quill, still reeling from the loss of Gamora, must rally his team around him to defend the universe along with protecting one of their own. A mission that, if not completed successfully, could quite possibly lead to the end of the Guardians as we know them.","Chris Pratt, Zoe Saldaña, Dave Bautista, Karen Gillan, Pom Klementieff",99.0,89.0,,92.0,79.0,"science fiction, adventure, action, comedy",James Gunn,150.0
guillermo del toro's pinocchio,2022,8.061,3030.0,"During the rise of fascism in Mussolini's Italy, a wooden boy brought magically to life struggles to live up to his father's expectations.","Ewan McGregor, David Bradley, Gregory Mann, Burn Gorman, Ron Perlman",99.0,89.0,,92.0,79.0,"animation, fantasy, drama, adventure, family, music",Mark Gustafson,117.0
gun crazy,1950,8.037,2182.0,,,98.0,84.0,http://www.rottentomatoes.com/m/1031278-gun_crazy,92.0,79.0,"crime, drama",Joseph H. Lewis,117.0
gunda,2020,8.037,2182.0,,,99.0,89.0,,89.0,71.0,documentary,Victor Kossakovsky,117.0
hachi: a dog's tale,2009,8.009,6801.0,A drama based on the true story of a college professor's bond with the abandoned dog he takes into his home.,"Richard Gere, Joan Allen, Sarah Roemer, Cary-Hiroyuki Tagawa, Erick Avari",99.0,89.0,,92.0,79.0,"drama, family",Lasse Hallström,93.0
hacksaw ridge,2016,8.192,14033.0,"WWII American Army Medic Desmond T. Doss, who served during the Battle of Okinawa, refuses to kill people and becomes the first Conscientious Objector in American history to receive the Congressional Medal of Honor.","Andrew Garfield, Sam Worthington, Vince Vaughn, Teresa Palmer, Luke Bracey",99.0,89.0,,92.0,79.0,"drama, history, war",Mel Gibson,139.0
hairspray,1988,8.037,2182.0,,,98.0,80.0,http://www.rottentomatoes.com/m/1009096-hairspray,92.0,79.0,comedy,John Waters,117.0
halloween,1978,8.037,2182.0,,,99.0,89.0,,90.0,84.0,"horror,thriller",John Carpenter,117.0
hamilton,2020,8.159,1474.0,"Presenting the tale of American founding father Alexander Hamilton, this filmed version of the original Broadway smash hit is the story of America then, told by America now.","Lin-Manuel Miranda, Leslie Odom Jr., Renée Elise Goldsberry, Phillipa Soo, Daveed Diggs",99.0,89.0,,88.0,77.0,"biography,drama,history,musical",Thomas Kail,160.0
hannah and her sisters,1986,8.037,2182.0,,,99.0,89.0,,90.0,82.0,"comedy,drama",Woody Allen,117.0
harakiri,1962,8.413,1060.0,"Down-on-his-luck veteran Tsugumo Hanshirō enters the courtyard of the prosperous House of Iyi. Unemployed, and with no family, he hopes to find a place to commit seppuku—and a worthy second to deliver the coup de grâce in his suicide ritual. The senior counselor for the Iyi clan questions the ronin’s resolve and integrity, suspecting Hanshirō of seeking charity rather than an honorable end. What follows is a pair of interlocking stories which lay bare the difference between honor and respect, and promises to examine the legendary foundations of the Samurai code.","Tatsuya Nakadai, Akira Ishihama, Shima Iwashita, Tetsuro Tamba, Masao Mishima",99.0,89.0,,92.0,79.0,"action, drama, history",Masaki Kobayashi,135.0
hard to be a god,2015,8.037,2182.0,,,99.0,89.0,,93.0,53.0,"drama,sci-fi",Aleksey German,117.0
hard truths,2024,8.037,2182.0,,,99.0,89.0,,88.0,57.0,"comedy,drama",Mike Leigh,117.0
harry potter and the deathly hallows: part 2,2011,8.087,20951.0,"Harry, Ron and Hermione continue their quest to vanquish the evil Voldemort once and for all. Just as things begin to look hopeless for the young wizards, Harry discovers a trio of magical objects that endow him with powers to rival Voldemort's formidable skills.","Daniel Radcliffe, Emma Watson, Rupert Grint, Ralph Fiennes, Alan Rickman",99.0,89.0,,92.0,79.0,"fantasy, adventure",David Yates,130.0
harry potter and the philosopher's stone,2001,7.902,28101.0,"Harry Potter has lived under the stairs at his aunt and uncle's house his whole life. But on his 11th birthday, he learns he's a powerful wizard—with a place waiting for him at the Hogwarts School of Witchcraft and Wizardry. As he learns to harness his newfound powers with the help of the school's kindly headmaster, Harry uncovers the truth about his parents' deaths—and about the villain who's to blame.","Daniel Radcliffe, Rupert Grint, Emma Watson, Richard Harris, Tom Felton",99.0,89.0,,92.0,79.0,"adventure, fantasy",Chris Columbus,152.0
harry potter and the prisoner of azkaban,2004,8.011,22029.0,"Year three at Hogwarts means new fun and challenges as Harry learns the delicate art of approaching a Hippogriff, transforming shape-shifting Boggarts into hilarity and even turning back time. But the term also brings danger: soul-sucking Dementors hover over the school, an ally of the accursed He-Who-Cannot-Be-Named lurks within the castle walls, and fearsome wizard Sirius Black escapes Azkaban. And Harry will confront them all.","Daniel Radcliffe, Rupert Grint, Emma Watson, Robbie Coltrane, Michael Gambon",99.0,89.0,,92.0,79.0,"adventure, fantasy",Alfonso Cuarón,141.0
heat,1995,7.92,7549.0,Obsessive master thief Neil McCauley leads a top-notch crew on various daring heists throughout Los Angeles while determined detective Vincent Hanna pursues him without rest. Each man recognizes and respects the ability and the dedication of the other even though they are aware their cat-and-mouse game may end in violence.,"Al Pacino, Robert De Niro, Val Kilmer, Jon Voight, Tom Sizemore",99.0,89.0,,92.0,79.0,"crime, drama, action",Michael Mann,170.0
henry v,1989,8.037,2182.0,,,100.0,89.0,http://www.rottentomatoes.com/m/1029042-henry_v,92.0,79.0,"drama, history",Kenneth Branagh,117.0
her,2013,8.037,2182.0,,,99.0,89.0,,91.0,85.0,"drama,romance,sci-fi",Spike Jonze,117.0
here,2024,8.037,2182.0,,,99.0,89.0,,92.0,67.0,drama,Bas Devos,117.0
hidden figures,2016,8.055,9911.0,"The untold story of Katherine G. Johnson, Dorothy Vaughan and Mary Jackson – brilliant African-American women working at NASA and serving as the brains behind one of the greatest operations in history – the launch of astronaut John Glenn into orbit. The visionary trio crossed all gender and race lines to inspire generations to dream big.","Taraji P. Henson, Octavia Spencer, Janelle Monáe, Kevin Costner, Kirsten Dunst",99.0,89.0,,92.0,79.0,"drama, history",Theodore Melfi,127.0
high and low,1963,8.34,962.0,"In the midst of an attempt to take over his company, a powerhouse executive is hit with a huge ransom demand when his chauffeur's son is kidnapped by mistake.","Toshirō Mifune, Tatsuya Nakadai, Kyōko Kagawa, Tatsuya Mihashi, Isao Kimura",99.0,89.0,,90.0,84.0,"crime,drama,mystery,thriller",Akira Kurosawa,142.0
high noon,1952,8.037,2182.0,,,99.0,89.0,,89.0,83.0,"drama,thriller,western",Fred Zinnemann,117.0
his girl friday,1940,8.037,2182.0,,,98.0,90.0,http://www.rottentomatoes.com/m/his_girl_friday,92.0,79.0,comedy,Howard Hawks,117.0
his house,2020,8.037,2182.0,,,100.0,75.0,http://www.rottentomatoes.com/m/his_house,92.0,79.0,"mystery and thriller, horror",Remi Weekes,117.0
hit the road,2022,8.037,2182.0,,,99.0,89.0,,91.0,72.0,"comedy,drama,music",Panah Panahi,117.0
homecoming: a film by beyoncé,2019,8.037,2182.0,,,98.0,87.0,http://www.rottentomatoes.com/m/homecoming_a_film_by_beyonce,92.0,79.0,nan,Unknown Director,117.0
hoop dreams,1994,8.037,2182.0,,,98.0,93.0,http://www.rottentomatoes.com/m/hoop_dreams,98.0,80.0,"documentary,drama,sport",Steve James,117.0
hope,2013,8.386,760.0,"After 8-year-old So-won narrowly survives a brutal sexual assault, her family labors to help her heal while coping with their own rage and grief.","Sul Kyung-gu, Uhm Ji-won, Lee Re, Kim Sang-ho, Kim Hae-sook",99.0,89.0,,92.0,79.0,drama,Lee Joon-Ik,122.0
host,2020,8.037,2182.0,,,100.0,72.0,http://www.rottentomatoes.com/m/host_2020,92.0,79.0,"horror, mystery and thriller",Rob Savage,117.0
hotarubi no mori e,2011,8.3,1139.0,"One hot summer day a little girl gets lost in an enchanted forest of the mountain god where spirits reside. A young boy appears before her, but she cannot touch him for fear of making him disappear. And so a wondrous adventure awaits...","Izumi Sawada, Hayato Taya, Ayane Sakura, Koki Uchiyama, Shinpachi Tsuji",99.0,89.0,,92.0,79.0,"romance, animation, fantasy",Takahiro Omori,45.0
house of flying daggers,2004,8.037,2182.0,,,99.0,89.0,,89.0,76.0,"action,adventure,drama,romance",Yimou Zhang,117.0
how green was my valley,1941,8.037,2182.0,,,99.0,89.0,,88.0,61.0,"drama,family",John Ford,117.0
how to survive a plague,2012,8.037,2182.0,,,98.0,82.0,http://www.rottentomatoes.com/m/how_to_survive_a_plague,92.0,79.0,"gay and lesbian, drama, history, documentary",David France,117.0
how to train your dragon,2010,8.037,2182.0,,,99.0,91.0,http://www.rottentomatoes.com/m/how_to_train_your_dragon,92.0,79.0,"comedy, fantasy, animation, kids and family, adventure","Chris Sanders, Dean Deblois",117.0
how to train your dragon: homecoming,2019,8.022,1002.0,"It's been ten years since the dragons moved to the Hidden World, and even though Toothless doesn't live in New Berk anymore, Hiccup continues the holiday traditions he once shared with his best friend. But the Vikings of New Berk were beginning to forget about their friendship with dragons. Hiccup, Astrid, and Gobber know just what to do to keep the dragons in the villagers' hearts. And across the sea, the dragons have a plan of their own...","Jay Baruchel, America Ferrera, Gerard Butler, Craig Ferguson, Christopher Mintz-Plasse",99.0,89.0,,92.0,79.0,"animation, fantasy, adventure, action, family",Tim Johnson,22.0
howards end,1992,8.037,2182.0,,,99.0,89.0,,88.0,81.0,"drama,romance",James Ivory,117.0
howl's moving castle,2004,8.398,10229.0,"Sophie, a young milliner, is turned into an elderly woman by a witch who enters her shop and curses her. She encounters a wizard named Howl and gets caught up in his resistance to fighting for the king.","Chieko Baisho, Takuya Kimura, Akihiro Miwa, Tatsuya Gashûin, Ryunosuke Kamiki",99.0,89.0,,92.0,79.0,"fantasy, animation, adventure",Hayao Miyazaki,119.0
i am cuba,1995,8.037,2182.0,,,99.0,89.0,,91.0,84.0,drama,Mikhail Kalatozov,117.0
i am not your negro,2016,8.037,2182.0,,,99.0,83.0,http://www.rottentomatoes.com/m/i_am_not_your_negro,95.0,54.0,"documentary,history",Raoul Peck,117.0
i called him morgan,2017,8.037,2182.0,,,99.0,89.0,,90.0,65.0,"documentary,drama,history,music",Kasper Collin,117.0
i want to eat your pancreas,2018,8.238,1601.0,"After his classmate and crush is diagnosed with a pancreatic disease, an average high schooler sets out to make the most of her final days.","Mahiro Takasugi, Lynn, Yukiyo Fujii, Yuma Uchida, Jun Fukushima",99.0,89.0,,92.0,79.0,"animation, drama, romance",Shinichiro Ushijima,108.0
i'm going home,2002,8.037,2182.0,,,99.0,89.0,,88.0,78.0,"comedy,drama",Manoel De Oliveira,117.0
i'm no longer here,2019,7.9,497.0,"In Monterrey, Mexico, a young street gang spends their days dancing to slowed-down cumbia and attending parties. After a mix-up with a local cartel, their leader is forced to migrate to the U.S. but quickly longs to return home.","Juan Daniel Garcia Treviño, Jonathan Espinoza, Xueming Angelina Chen, Bianca Coral Puente Valenzuela, Tania Alvarado",99.0,89.0,,92.0,79.0,drama,Luis Fernando Frías De La Parra,112.0
i'm still here,2024,8.0,599.0,"In 1971, military dictatorship in Brazil reaches its height. The Paiva family — Rubens, Eunice, and their five children — live in a beachside house in Rio, open to all their friends. One day, Rubens is taken for questioning and does not return.","Fernanda Torres, Selton Mello, Valentina Herszage, Bárbara Luz, Guilherme Silveira",99.0,89.0,,92.0,79.0,"drama, history",Walter Salles,138.0
ida,2014,8.037,2182.0,,,99.0,89.0,,91.0,75.0,drama,Pawel Pawlikowski,117.0
ikiru,1952,8.316,1192.0,"Kanji Watanabe is a middle-aged man who has worked in the same monotonous bureaucratic position for decades. Learning he has cancer, he starts to look for the meaning of his life.","Takashi Shimura, Haruo Tanaka, Nobuo Kaneko, Bokuzen Hidari, Miki Odagiri",98.0,97.0,http://www.rottentomatoes.com/m/ikiru,92.0,79.0,drama,Akira Kurosawa,143.0
