id,title,releaseDate,rating,genres,description,duration,tagline,metascore,metascore_count,metascore_sentiment,userscore,userscore_count,userscore_sentiment,production_companies,director,writer,top_cast
2000542721,Leviathan,2014-12-25,R,"Crime,Drama","Kolia lives in a small town near the Barents Sea in North Russia. He has his own auto-repair shop. His shop stands right next to the house where he lives with his young wife Lilya and his son from a previous marriage. Vadim Shelevyat, the Mayor of the town, wants to take away his business, his house and his land. First he tries buying off Kolia, but Kolia cannot stand losing everything he has, not only the land, but also all the beauty that has surrounded him from the day of his birth. So Vadim Shelevyat starts being more aggressive.",140,,92.0,34,Universal acclaim,73.0,276.0,Generally favorable,"Non-Stop Productions,A Company Russia,Russian Ministry of Culture,Fond kino,RuArts Foundation,,Sony Pictures Classics,20th Century Fox CIS,Bitters End,Cinecolor Films,Cinema Mondo,Edko Films,IFA,Lumière,M3 Film,Pyramide Distribution,Sony Pictures Classics,Spentzos Films,Wild Bunch Germany,Wild Bunch,Academy 2,Against Gravity,Calinos Films,Canvas,EuroVideo,Fetisoff Illusion - Europe,Film1,Golem Distribución,Leopardo Filmes,Lumière Home Entertainment,NDMantarraya,Scanbox Entertainment,Yleisradio (YLE)",Andrey Zvyagintsev,"Oleg Negin,Andrey Zvyagintsev","Aleksey Serebryakov,Elena Lyadova,Roman Madyanov,Vladimir Vdovichenkov,Anna Ukolova,Aleksey Rozin,Sergey Pokhodaev,Platon Kamenev,Sergey Bachurskiy,Valeriy Grishko,Alla Emintseva,Margarita Shubina,Dmitriy Bykovskiy-Romashov,Sergey Borisov,Igor Savochkin,Igor Sergeev,Konstantin Telegin,Olga Lapshina,Mariya Skornitskaya,Irina Ryndina"
2000558307,Menus Plaisirs - Les Troisgros,2023-11-22,,Documentary,"Menus Plaisirs - Les Troisgros is a film about the Troisgros family and their three restaurants, Troisgros, Le Central and Colline, located in three neighboring locations in central France. Troisgros, a restaurant founded 93 years ago, has had three Michelin stars for 55 years and in 2020 was awarded a Michelin green star for exemplary sustainable practices. Much of the film takes place at Troisgros.  The present chef, Cesar Troisgros, is the fourth generation of the family to be in charge at Troisgros. The film shows the day-to-day operations involving the purchase, preparation and service at this restaurant .",240,,92.0,18,Universal acclaim,83.0,7.0,Universal acclaim,"Zipporah Films,Zipporah Films,Météore Films,Madman Entertainment,Madman Films",Frederick Wiseman,,"Marie-Pierre Troigros,César Troisgros,Léo Troisgros,Michel Troisgros"
2000520983,Le Cercle Rouge (1970),2003-01-10,Not Rated,"Crime,Drama,Thriller","Corey (Alain Delon) is an aristocratic thief, released from prison on the same day that Vogel (Gian-Maria Volonté), a murderer, escapes from the custody of Mattei (Bourvil), a cat-loving police superintendent. Corey robs Rico (André Ekyan), his mob boss, then enlists Vogel and an ex-police sharpshooter, Jansen (Yves Montand), in a jewel heist. While Corey is harried by the vengeful Rico, Mattei pressures Santi, a nightclub owner and pimp, to help him trap the thieves.",140,The Red Circle is a powerful in-depth study of the French Underworld,92.0,19,Universal acclaim,81.0,37.0,Universal acclaim,"Comacico,Euro International Films,Fono Roma,Les Films Corona,Selenia Cinematografica,Rialto Pictures,Les Films Corona,Fida Cinematografica,Nederland Film,Toho-Towa,Towa.,Belga Films,Columbia Film-Verleih,Columbia Film-Verleih,Columbia-Warner Distributors,Filmax International,Cinema Mondo,Columbia Pictures,Global Filmindustria,Sophie Dulac Distribution,Stadtkino Filmverleih,ARTE,Antenne 2 (A2),Antenne 2 (A2),Arthaus,Arthaus,Arthaus,BFI Video,BFI Video,BFI Video,C8,Ciné+,Dong Yang Films,Film Office,France 5,La Cinq,La Cinq,La Cinq,Les Grands Films Classiques (GFC),Nordic Video,Optimum Releasing,StudioCanal UK,StudioCanal,Studiocanal Vidéo,Süddeutsche Zeitung,The Criterion Collection,The Criterion Collection,Topanga Canyon Films,Umbrella Entertainment,Universal-Studio Canal",Jean-Pierre Melville,Jean-Pierre Melville,"Alain Delon,Bourvil,Gian Maria Volontè,Yves Montand,Paul Crauchet,Paul Amiot,Pierre Collet,André Ekyan,Jean-Pierre Posier,François Périer,Yves Arcanel,René Berthier,Jean-Marc Boris,Jean Champion,Yvan Chiffre,Anna Douking,Robert Favart,Roger Fradet,Édouard Francomme,Jean Franval"
2000538489,Toy Story 3,2010-06-18,G,"Animation,Adventure,Comedy,Family,Fantasy","Toy Story 3 is a comical new adventure in Disney Digital 3D that lands the toys in a room full of untamed tots who can't wait to get their sticky little fingers on these ""new"" toys. It's pandemonium as they try to stay together, ensuring ""no toy gets left behind."" Meanwhile, Barbie comes face to plastic face with Ken (yes, that Ken). [Disney, Pixar]",103,The Breakout Comedy Of The Summer,92.0,39,Universal acclaim,88.0,1828.0,Universal acclaim,"Walt Disney Pictures,Pixar Animation Studios,Walt Disney Studios Motion Pictures,Walt Disney Studios Motion Pictures, Italia,Walt Disney Studios Motion Pictures Germany,Walt Disney Studios Motion Pictures Mexico,Walt Disney Studios Motion Pictures Finland,Walt Disney Studios Motion Pictures Norway,Ster-Kinekor Pictures,United International Pictures (UIP),Walt Disney Studios Motion Pictures Japan,Audio Visual Enterprises,B&H Film Distribution,Buena Vista International,Cinecolor Films Perú,Cinecolor Films,Falcon,Forum Cinemas,Forum Film Poland,Forum Film,Forum Hungary,NOS Audiovisuais,Saturn Films,Walt Disney Studios Motion Pictures Argentina,Walt Disney Studios Sony Pictures Releasing (WDSSPR),InterCom Home Entertainment,Walt Disney Studios Home Entertainment,Walt Disney Studios Home Entertainment,Walt Disney Studios Home Entertainment,Walt Disney Studios Home Entertainment,Walt Disney Studios Home Entertainment,Walt Disney Studios Home Entertainment,Walt Disney Studios Home Entertainment,Walt Disney Studios Home Entertainment,Walt Disney Studios Home Entertainment,Walt Disney Studios Home Entertainment,Walt Disney Studios Home Entertainment,Walt Disney Studios Home Entertainment,Disney Cinemagic,Film1,Starz,Walt Disney Studios Home Entertainment,ABC Family,BBC One,Disney Channel,Nelonen,American Broadcasting Company (ABC),Hotstar,Freeform,Disney+,Disney+,Walt Disney Studios Home Entertainment,Walt Disney Studios Home Entertainment,Walt Disney Studios Home Entertainment,Channel 4,TV Tokyo,9Go!,Buena Vista Home Entertainment,Buena Vista Home Entertainment,Nickelodeon Network,Gentle Giant Studios",Lee Unkrich,"John Lasseter,Andrew Stanton,Lee Unkrich,Michael Arndt,Mark Andrews,David Reynolds,Justin Wright","Tom Hanks,Tim Allen,Joan Cusack,Ned Beatty,Don Rickles,Michael Keaton,Wallace Shawn,John Ratzenberger,Estelle Harris,John Morris,Jodi Benson,Emily Ricks Hahn,Laurie Metcalf,Blake Clark,Teddy Newton,Bud Luckey,Bea Miller,Javier Fernández-Peña,Timothy Dalton,Lori Alan"
2000560669,Seeds,0000-00-00,,Documentary,An exploration of Black generational farmers in the American South reveals the fragility of legacy and the significance of owning land.,123,,92.0,7,Universal acclaim,0.0,0.0,,Walking Productions,Brittany Shyne,,
2000550103,The Souvenir,2019-05-17,R,"Drama,Romance","A shy but ambitious film student (Honor Swinton Byrne) begins to find her voice as an artist while navigating a turbulent courtship with a charismatic but untrustworthy man (Tom Burke). She defies her protective mother (Tilda Swinton) and concerned friends as she slips deeper and deeper into an intense, emotionally fraught relationship that comes dangerously close to destroying her dreams. [A24]",120,The Past Never Stays in Focus.,92.0,45,Universal acclaim,64.0,104.0,Generally favorable,"BBC Film,BFI Film Fund,JWH Films,Protagonist Pictures,Sikelia Productions,A24,Condor,Curzon Film Distributors,Mongrel Media,Universal Pictures International (UPI),Must Käsi,Must Käsi,Must Käsi",Joanna Hogg,Joanna Hogg,"Tom Burke,Tilda Swinton,Frankie Wilson,Tosin Cole,Honor Swinton Byrne,Hannah Ashby Ward,Janet Etuk,Chyna Terrelonge-Vaughan,Jack McMullen,Neil Young,Alice McMillan,Barbara Peirson,James Dodds,Dick Fontaine,Crispin Buxton,James Spencer Ashworth,Richard Ayoade,Lydia Fox,Jaygann Ayeh,El Pilkington"
2000522003,This Is Spinal Tap,1984-03-02,TV-14,"Comedy,Music","Spinal Tap, one of England's loudest bands, is chronicled by film director Marty DiBergi on what proves to be a fateful tour.",82,This ain't just rock and roll . . .,92.0,30,Universal acclaim,80.0,134.0,Generally favorable,"Spinal Tap Prod.,Goldcrest Films International,Embassy Pictures,Mainline Pictures,Goldcrest Films International,CEL Film Distribution,Embassy Home Entertainment Australia,Europa Vision,Savoy Filmi,Syncron Film,Herald Nelson,Nippon AVC Co.,Yleisradio (YLE),The Voyager Company,Metro-Goldwyn-Mayer (MGM),A-Film Distribution,Mainostelevisio (MTV3),MGM Home Entertainment,Sandrew Metronome Distribution,SubTV,Front Row Filmed Entertainment,Universal Pictures Finland,Rialto Pictures,Carlotta Films,Embassy Home Entertainment,Pluto TV",Rob Reiner,"Christopher Guest,Michael McKean,Harry Shearer,Rob Reiner","Rob Reiner,Michael McKean,Christopher Guest,Kimberly Stringer,Chazz Dominguez,Shari Hall,R.J. Parnell,David Kaff,Tony Hendra,Harry Shearer,Bruno Kirby,Jean Cromie,Patrick Maher,Ed Begley Jr.,Danny Kortchmar,Fran Drescher,Patrick Macnee,Memo Vera,Julie Payne,Dana Carvey"
2000522335,Goodfellas,1990-09-01,TV-MA,"Biography,Crime,Drama","Based on the bestselling book ""Wiseguy"" by Nicholas Pileggi, Scorsese's film profiles nearly 30 years of mob life in New York City.",146,"""As far back as I can remember, I've always wanted to be a gangster."" -- Henry Hill, Brooklyn, N.Y. 1955.",92.0,21,Universal acclaim,90.0,1183.0,Universal acclaim,"Warner Bros.,Warner Bros. Pictures,Warner Bros.,Warner Bros.,Zweites Deutsches Fernsehen (ZDF),Roadshow Films,Warner & Metronome Film,Warner Bros. Film,Warner Bros. Finland,Warner Bros. Pictures Germany,Warner Bros. Pictures Mexico,Warner Bros.,Warner Bros.,Warner Bros.,Warner Bros.,Warner Bros.,Yleisradio (YLE),Argentina Video Home,Fazer Musiikki Oy/Fazer Video,Home Box Office (HBO),VideoVisa,Warner Home Video,Cinemax,FilmNet,Warner Home Video,Warner Home Video,Argentina Video Home,Argentina Video Home,CBS,Mainostelevisio (MTV3),Varus Video,Warner Home Video,Warner Home Vídeo,Warner Home Vídeo,Sandrews,Veronica Omroep Organisatie,Warner Home Video,Warner Home Video,SubTV,Sandrew Metronome Distribution,Warner Home Video,Warner Home Video,FX Network,Warner Home Video,Warner Home Video,Warner Home Video,Action Cinémas,HBO Zone,Argentina Video Home,Warner Home Video,Warner Home Video,TV Tokyo,Hotstar,Sub,Warner Home Video,Warner Home Video,Dave,Warner Home Video,Warner Home Video,Eye Film Instituut,Warner Home Video,Warner Home Video,7Two,HBO Max",Martin Scorsese,"Nicholas Pileggi,Martin Scorsese","Robert De Niro,Ray Liotta,Joe Pesci,Lorraine Bracco,Paul Sorvino,Frank Sivero,Tony Darrow,Mike Starr,Frank Vincent,Chuck Low,Frank DiLeo,Henny Youngman,Gina Mastrogiacomo,Catherine Scorsese,Charles Scorsese,Suzanne Shepherd,Debi Mazar,Margo Winkler,Welker White,Jerry Vale"
2000557674,The Zone of Interest,2023-12-15,PG-13,"Drama,History,War","The commandant of Auschwitz, Rudolf Höss, and his wife Hedwig, strive to build a dream life for their family in a house and garden next to the camp.",105,Build a dream life for their family,92.0,58,Universal acclaim,76.0,253.0,Generally favorable,"A24,Access Entertainment,Film4,JW Films,Extreme Emotions,House Productions,Polski Instytut Sztuki Filmowej,Silesian Film Fund,A24,Bac Films,Cinéart,Cinéart,Diamond Films,Diamond Films,Diamond Films,Elástica Films,Empire Entertainment,Filmcoopi,Gutek Film,Leonine Distribution,Madman Entertainment,Madman Films,SF Film Finland,Spentzos Films,Alambique Filmes,Amazon Prime Video,Apple TV+,Bad Unicorn,Blaq Out,Blaq Out,Blaq Out,Cinemax,Falcon Pictures,HBO Max,Impact Films,KlikFilm,Leonine Distribution,Leonine Distribution,Leonine Distribution,MUBI,Madman Entertainment,Madman Entertainment,Max,Wanda Visión,One Of Us,Firebrand VFX",Jonathan Glazer,"Jonathan Glazer,Martin Amis","Christian Friedel,Sandra Hüller,Johann Karthaus,Luis Noah Witte,Nele Ahrensmeier,Lilli Falk,Anastazja Drobniak,Cecylia Pekala,Kalman Wilson,Medusa Knopf,Max Beck,Slava the Dog,Andrey Isaev,Julia Babiarz,Stephanie Petrowitz,Martyna Poznanski,Zuzanna Kobiela,Benjamin Utzerath,Thomas Neumann,Klaudiusz Kaufmann"
2000542384,Alphaville,1965-10-25,Not Rated,"Comedy,Drama,Mystery,Sci-Fi,Thriller",A U.S. secret agent is sent to the distant space city of Alphaville where he must find a missing person and free the city from its tyrannical ruler.,99,The strange adventure of Lemmy Caution - secret agent of the future,92.0,7,Universal acclaim,81.0,8.0,Universal acclaim,"André Michelin Productions,Filmstudio,Chaumiane,Athos Films,Athos Films,Pathé Contemporary Films,Elan Films,Filmstudio,Pallas Filmverleih,Syncronfilm,Warner-Tonefilm,Connoisseur Film Ltd.,Lumina Film,Rosa Films S.A.,Art Theatre Guild (ATG),Palace Video,Rai 2,Connoisseur Video Collection,The Criterion Collection,The Criterion Collection,La Cinquième,Warner Home Video,Continental Home Vídeo,British Film Institute (BFI),Raro Video,ARTE,Arthaus,Rialto Pictures,New Star,HBO Max,Ciné+,Umbrella Entertainment,The Criterion Channel,Leopardo Filmes,Janus Films,Mundial Filmes",Jean-Luc Godard,"Jean-Luc Godard,Paul Éluard","Eddie Constantine,Anna Karina,Akim Tamiroff,Valérie Boisgel,Jean-Louis Comolli,Michel Delahaye,Jean-André Fieschi,Christa Lang,Jean-Pierre Léaud,László Szabó,Howard Vernon"
2000543036,The Look of Silence,2015-07-17,PG-13,"Documentary,Biography,History","The Look of Silence is Joshua Oppenheimer's powerful companion piece to the Oscar®-nominated The Act of Killing. Through Oppenheimer's footage of perpetrators of the 1965 Indonesian genocide, a family of survivors discovers how their son was murdered, as well as the identities of the killers. The documentary focuses on the youngest son, an optometrist named Adi, who decides to break the suffocating spell of submission and terror by doing something unimaginable in a society where the murderers remain in power: he confronts the men who killed his brother and, while testing their eyesight, asks them to accept responsibility for their actions.",103,"Profound, Visionary, Stunning.",92.0,29,Universal acclaim,83.0,93.0,Universal acclaim,"Anonymous,Britdoc Foundation,Final Cut for Real,Making Movies,Participant,Piraya Film,Spring Films,Drafthouse Films,Avalon,Blue Ice Docs,Cinema Delicatessen,Filmcenter Trianon,Koch Media,Madman Entertainment,Maison Motion,Transformer,Why Not Productions,ARTE,ARTE,DR K,I Wonder Pictures,Koch Media,Kurmaca Film,Norsk Rikskringkasting (NRK),True Content Entertainment,Vrijzinnig Protestantse Radio Omroep (VPRO),Yleisradio (YLE),Zweites Deutsches Fernsehen (ZDF),Nordisk Film ShortCut",Joshua Oppenheimer,,"Adi Rukun,M.Y. Basrun,Volker Hanisch,Amir Hasan,Inong,Kemat,Joshua Oppenheimer,Achim Schülke,Amir Siahaan,Ted Yates"
2000545621,Tower,2016-10-12,TV-14,"Documentary,Animation,Crime","August 1, 1966, was the day our innocence was shattered. A sniper rode the elevator to the top floor of the iconic University of Texas Tower and opened fire, holding the campus hostage for 96 minutes in what was a previously unimaginable event. TOWER combines archival footage with rotoscopic animation of the dramatic day, based entirely on first person testimonies from witnesses, heroes and survivors, in a seamless and suspenseful retelling of the unfolding tragedy. The film highlights the fear, confusion, and visceral realities that changed the lives of those present, and the rest of us, forever – a day when the worst in one man brought out the best in so many others.",96,,92.0,22,Universal acclaim,79.0,59.0,Generally favorable,"Go-Valley,Texas Archive of the Moving Image,Killer Impact,Meredith Vieira Productions,Minnow Mountain,Kino Lorber,The Criterion Channel",Keith Maitland,Pamela Colloff,"Monty Muir,Violett Beane,Cole Bee Wilson,Aldo Ordoñez,Blair Jackson,Vicky Illk,Chris Doubek,Séamus Bolivar-Ochoa,Louie Arnette,Josephine McAdam,Lee Zamora,Rebecca Beegle,Ron Pippin,Steve Eckelman,Timothy Lucas,Karen Davidson,Jeremy Brown,Cole Bresnehen,Tyler Mager,John Fitch"
2000548729,Burning,2018-10-26,Not Rated,"Drama,Mystery","The difficult life of Jongsu (Ah-in Yoo), a frustrated introvert, is complicated by the appearance of two people into his orbit: first, Haemi (Jong-seo Jun), a spirited woman who offers romantic possibility, and then, Ben (Steven Yeun), a wealthy and sophisticated young man she returns with from a trip. When Jongsu learns of Ben’s mysterious hobby and Haemi suddenly disappears, his confusion and obsessions begin to mount, culminating in a stunning finale.",148,Now Tell the Truth,91.0,39,Universal acclaim,77.0,227.0,Generally favorable,"Pine House Film,NHK,Now Films,Thunderbird Releasing,Well Go USA Entertainment,CJ Entertainment,Golden Village Pictures,Hualien Media International,Interior13 Cine,Interior13 Cine,Pandora Filmes,Polyfilm Verleih,Seven Films,TWIN,Alambique Destilaria de Ideias,Aurora Films,Capelight Pictures,Cinefil Co,Clover Films,Diaphana Distribution,Edko Films,Edko Films,Film & TV House,Folkets Bio,Future Film,Imagine,NHK,Palace Films,Palace Films,Provzglyad,Tucker Film,Vértigo,Well Go USA Entertainment,World Cinema Partners,Xenix Filmdistribution,Yleisradio (YLE),Zinos Panagiotidis & Co.,Magnon Studio,Studio M",Lee Chang-dong,"Jungmi Oh,Lee Chang-dong,Haruki Murakami,William Faulkner","Yoo Ah-in,Steven Yeun,Jeon Jong-seo,Kim Soo-Kyung,Choi Seung-ho,Moon Sung-Keun,Min Bok-gi,Lee Soo-Jeong,Ban Hye-ra,Cha Mi-kyung,Lee Bong-ryun,Ja-Yeon Ok,Joong-ok Lee,Seok-Chan Jeon,Shin-rock Kim,Wonhyeong Jang,Yong-joon Jo,Donald Trump"
2000554687,Drive My Car,2021-11-24,Unrated,Drama,"Two years after his wife’s unexpected death, Yusuke Kafuku (Hidetoshi Nishijima), a renowned stage actor and director, receives an offer to direct a production of Uncle Vanya at a theater festival in Hiroshima. There, he meets Misaki Watari (Toko Miura), a taciturn young woman assigned by the festival to chauffeur him in his beloved red Saab 900. As the production’s premiere approaches, tensions mount amongst the cast and crew, not least between Yusuke and Koji Takatsuki, a handsome TV star who shares an unwelcome connection to Yusuke’s late wife. Forced to confront painful truths raised from his past, Yusuke begins - with the help of his driver – to face the haunting mysteries his wife left behind.  Adapted from Haruki Murakami’s short story. [Janus Films]
",179,,91.0,42,Universal acclaim,76.0,170.0,Generally favorable,"Bitters End,Bungeishunju,C&I Entertainment,Culture Entertainment,Drive My Car Production Committee,Japan Arts Council,Japanese Agency for Cultural Affairs,L'espace Vision,Nekojarashi,Nippon Shuppan Hanbai (Nippan) K.K.,Quaras,The Asahi Shimbun Company,Janus Film,Janus Films,Bitters End,Diaphana Distribution,Gutek Film,Modern Films,Lighthouse Pictures,Sister Distribution,Tucker Film,Elástica Films,Exponenta,Films We Like,Future Film,MUBI,O2 Play,Rapid Eye Movies,September Film,Sideshow (II),ARD Plus,ARTE Mediathek,ARTE Mediathek,ARTE,ARTE,Amazon Instant Video,Diaphana Distribution,Diaphana Distribution,Exponenta,Filmfriend,Filmin,Google Play,HBO Max,Leopardo Filmes,MUBI,MUBI,MUBI,MagentaTV,Maxdome Store,Maxdome,Rakuten TV,Rapid Eye Movies,Rapid Eye Movies,September Film,Sky Store,TC Entertainment,TC Entertainment,The Criterion Channel,Yleisradio (YLE),Youtube Filme & TV,Zhen Pictures,iTunes,Spade & Co.,Sultamedia FX",Ryûsuke Hamaguchi,"Haruki Murakami,Ryûsuke Hamaguchi,Takamasa Ôe","Hidetoshi Nishijima,Tôko Miura,Reika Kirishima,Masaki Okada,Park Yu-rim,Jin Dae-yeon,Sonia Yuan,Ahn Hwitae,Perry Dizon,Satoko Abe,Hiroko Matsuda,Toshiaki Inomata,Takako Yamamura,Ryô Iwase,Faisal Anwar,Kamal Zharif,Massimo Biondi,Shôichirô Tanigawa,Keiko Nishi,Saki Suzuki"
2000521938,Moolaadé,2004-10-15,Unrated,Drama,"A rousing polemic directed against the still common African practice of female circumcision, Moolaadé is set in a small African village, where four young girls facing ritual ""purification"" flee to the household of Collé Ardo Gallo Sy, a strong-willed woman who has managed to shield her own teenage daughter from mutilation. Collé invokes the time-honored custom of moolaadé (sanctuary) to protect the fugitives, and tension mounts as the ensuing stand-off pits Collé against village traditionalists (both male and female) and endangers the prospective marriage of her daughter to the heir-apparent to the tribal throne. [New Yorker Films]",124,"Set in Burkina Faso, an inspiring story about a group of women who stand up for their rights against the traditions of their village",91.0,26,Universal acclaim,89.0,15.0,Universal acclaim,"Filmi Domirev,Direction de la Cinematographie Nationale,Centre Cinématographique Marocain,Cinétéléfilms,Les Films Terre Africaine,Ciné-Sud Promotion,Fonds Sud Cinéma,Centre national du cinéma et de l'image animée (CNC),Ministère des Affaires étrangères et du Développement International,New Yorker Films,Cinemien,Folkets Bio,Les Films du Paradoxe,Lucky Red,Sharmill Films,Stadtkino Filmverleih,Xenix Filmdistribution,Giangiacomo Feltrinelli Editore,Madman Entertainment",Ousmane Sembene,Ousmane Sembene,"Fatoumata Coulibaly,Maimouna Hélène Diarra,Salimata Traoré,Dominique Zeïda,Mah Compaoré,Aminata Dao,Rasmané Ouédraogo,Ousmane Konaté,Bakaramoto Sanogo,Modibo Sangaré,Joseph Traoré,Théophile Sowié,Habib Dembélé,Gustave Sorgho,Cheick Oumar Maiga,Sory Ibrahima Koïta,Aly Sanon,Moussa Sanogo,Naky Sy Savane,Stéphanie Nikiema"
2000542835,A Summer's Tale,2014-06-20,G,"Comedy,Drama,Romance","Gaspard (Melvil Poupaud), a recent university graduate, arrives at the seaside in Bretagne for a three week vacation before starting a new job. He’s hoping his sort-of girlfriend, the fickle Léna (Aurélia Nolin), will join him there; but as the days pass, he welcomes the interest of Margot (Amanda Langlet), a student of ethnology working as a waitress for the summer. Things start to get complicated when the spoken-for Margot encourages Gaspard to have a summer romance with her friend, Solène (Gwenaëlle Simon), and he complies. When Léna turns up, and scheduling complications abound, Gaspard will have to make a choice. [Big World Pictures]",113,,91.0,14,Universal acclaim,79.0,18.0,Generally favorable,"Canal+,La Sept Cinéma,Les Films du Losange,Sofilmka,Big World Pictures,Les Films du Losange,Rosebud,NFM Distributie,Telefilm Hellas,Europa Filmes,Arthaus,Arthaus,Leopardo Filmes,Sharmill Films,Triangelfilm,Artificial Eye,Atalanta Filmes,Mongrel Media,Musidora Films,Primer Plano Film Group,Sandrews Video",Éric Rohmer,Éric Rohmer,"Melvil Poupaud,Amanda Langlet,Gwenaëlle Simon,Aurelia Nolin,Aimé Lefèvre,Alain Guellaff,Evelyne Lahana,Yves Guérin,Franck Cabot-David"
2000556657,Saint Omer,2023-01-13,PG-13,Drama,"Saint Omer court of law. Young novelist Rama attends the trial of Laurence Coly, a young woman accused of killing her 15-month-old daughter by abandoning her to the rising tide on a beach in northern France. But as the trial continues, the words of the accused and witness testimonies will shake Rama’s convictions and call into question our own judgment.",122,,91.0,37,Universal acclaim,54.0,42.0,Mixed or average,"Srab Films,Arte France Cinéma,Pictanovo,ARTE,Canal+,Ciné+,Centre national du cinéma et de l'image animée (CNC),La Région Île-de-France,Région Hauts-de-France,Fonds Images de la Diversité,Agence Nationale pr Cohésion des Territoires,Cofinova 18,Indéfilms 10,Ciclic-Region Centre-Val de Loire,Région Nouvelle-Aquitaine,Cinécap 3 Développement,Cinémage 13 Développement,Cofinova Développement 15,Super LTD,Cherry Pickers Filmdistributie,Cherry Pickers Filmdistributie,Cineworx,Cineworx,Edge Entertainment,Edge Entertainment,Edge Entertainment,Edge Entertainment,Film Europe,Filmgarten,Films We Like,Grandfilm,Hooray Film,Interior13 Cine,Kino Pavasaris,Les Films du Losange,Lev Cinemas,MCF,Medusa,Megacom Films,Megacom Films,Megacom Films,Megacom Films,Minerva Pictures,New Horizon Entertainment,One from the heart,Palace Films,Palace Films,Picturehouse Entertainment,Picturehouse Entertainment,Surtsey Films,Transformer,Wild Bunch International,375 Media,Front Row Filmed Entertainment,NOS Audiovisuais,Super,Teleview International,Vertigo Média Kft.",Alice Diop,"Alice Diop,Amrita David,Marie N'Diaye,Zoé Galeron","Kayije Kagame,Guslagie Malanda,Valérie Dréville,Aurélia Petit,Xavier Maly,Robert Cantarella,Salimata Kamate,Thomas de Pourquery,Adama Diallo Tamba,Mariam Diop,Dado Diop,Charlotte Clamens,Seyna Kane,Coumba-Mar Thiam,Binta Thiam,Alain Payen,Louise Lemoine Torrès,Roald Iamonte,Gaëtan Leleu"
